{"device_id":"30ad1113-88be-44fd-90fd-683d0a3dd7b0","issued_at":"2026-10-14T12:00:00.000Z","resource_id":"0xaaaaaaaaaaaaaaaaaaaaaaaaaaaaaaaaaaaaaaaaaaaaaaaaaaaaaaaaaaaaaaaa","schema_version":1,"sequence":1,"signature_b64":"AAAAAAAAAAAAAAAAAAAAAAAAAAAAAAAAAAAAAAAAAAAAAAAAAAAAAAAAAAAAAAAAAAAAAAAAAAAAAAAAAAAAAA==","telemetry":{"rpm":1450,"temp_c":93.2,"vibration_mm_s":7.1}}